{
	"contract": {
		"name": "ue-shed-niagara-preview-request",
		"version": { "major": 1, "minor": 0 }
	},
	"runId": "11111111-1111-4111-8111-111111111111",
	"settings": {
		"captureMode": "component_only",
		"durationSeconds": 1,
		"frameCount": 2,
		"height": 64,
		"simulationFramesPerSecond": 60,
		"startSeconds": 0,
		"width": 64
	},
	"systemObjectPath": "/Game/Fixture/Niagara/NS_Preview.NS_Preview"
}
